{
  "id": "necrobinder",
  "label": "Necrobinder",
  "api": 1,
  "extends": "sts",
  "description": "Violet de la Tisse-Mort : accent #EE82EE (NameColor), teinte du verre #702D6F (EnergyLabelOutlineColor).",
  "tones": {
    "text": "#FFF6E2",
    "muted": "#FFF6E299",
    "accent": "#EE82EE",
    "danger": "#FF5555",
    "ok": "#7FFF00",
    "warn": "#FFA518",
    "curse": "#EE82EE",
    "enchant": "#2AEBBE",
    "info": "#87CEEB",
    "grade.S": "#EE82EE",
    "grade.A": "#7FFF00",
    "grade.B": "#2AEBBE",
    "grade.C": "#87CEEB",
    "grade.D": "#FFA518",
    "grade.F": "#FF5555",
    "background": "#170D17",
    "border": "#EE82EE66"
  },
  "logColors": {
    "timestamp": "muted",
    "debug": "muted",
    "info": "text",
    "warn": "warn",
    "error": "danger"
  },
  "glass": {
    "tint": "#702D6F",
    "tintOpacity": 0.45
  }
}
