{
  "id": "regent",
  "label": "Regent",
  "api": 1,
  "extends": "sts",
  "description": "Or du Régent : accent #FFA518 (NameColor), teinte du verre #784000 (EnergyLabelOutlineColor).",
  "tones": {
    "text": "#FFF6E2",
    "muted": "#FFF6E299",
    "accent": "#FFA518",
    "danger": "#FF5555",
    "ok": "#7FFF00",
    "warn": "#FFA518",
    "curse": "#EE82EE",
    "enchant": "#2AEBBE",
    "info": "#87CEEB",
    "grade.S": "#FFA518",
    "grade.A": "#7FFF00",
    "grade.B": "#2AEBBE",
    "grade.C": "#87CEEB",
    "grade.D": "#FFA518",
    "grade.F": "#FF5555",
    "background": "#1A1206",
    "border": "#FFA51866"
  },
  "logColors": {
    "timestamp": "muted",
    "debug": "muted",
    "info": "text",
    "warn": "warn",
    "error": "danger"
  },
  "glass": {
    "tint": "#784000",
    "tintOpacity": 0.45
  }
}
